date,name,total_volume,percentage,current_volume,sensor_current_volume,sensor_total_volume,sensor_percentage
2024-06-12,Embassament de Darnius Boadella (Darnius),138.91,22.7,13.88,CALC000005,170600-001-ANA021,CALC000046
2024-06-12,Embassament de Foix (Castellet i la Gornal),98.55,69.9,2.62,CALC000004,080581-002-ANA006,CALC000041
2024-06-12,Embassament de Riudecanyes,194.33,2.4,0.13,CALC000108,430537-001-ANA006,CALC000120
2024-06-12,Embassament de Sant Ponç (Clariana de Cardener),515.09,34.5,8.42,CALC000699,250753-004-ANA010,CALC000735
2024-06-12,Embassament de Sau (Vilanova de Sau),398.91,31.9,52.78,CALC000145,083036-001-ANA023,CALC000152
2024-06-12,Embassament de Siurana (Cornudella de Montsant),452.24,2.2,0.27,CALC000123,430496-001-ANA001,CALC000125
2024-06-12,Embassament de Susqueda (Osor),314.04,34.0,79.21,CALC000158,171169-001-ANA009,CALC000168
2024-06-12,Embassament de la Baells (Cercs),610.4,47.9,52.44,CALC000697,082687-001-ANA015,CALC000713
2024-06-12,Embassament de la Llosa del Cavall (Navès),775.21,27.2,21.72,CALC000698,081419-003-ANA005,CALC000722
