date,name,total_volume,percentage,current_volume,sensor_current_volume,sensor_total_volume,sensor_percentage
2024-03-12,Embassament de Darnius Boadella (Darnius),132.45,11.6,7.08,CALC000005,170600-001-ANA021,CALC000046
2024-03-12,Embassament de Foix (Castellet i la Gornal),97.81,60.1,2.25,CALC000004,080581-002-ANA006,CALC000041
2024-03-12,Embassament de Riudecanyes,194.61,2.7,0.14,CALC000108,430537-001-ANA006,CALC000120
2024-03-12,Embassament de Sant Ponç (Clariana de Cardener),512.37,26.6,6.5,CALC000699,250753-004-ANA010,CALC000735
2024-03-12,Embassament de Sau (Vilanova de Sau),374.97,3.0,5.0,CALC000145,083036-001-ANA023,CALC000152
2024-03-12,Embassament de Siurana (Cornudella de Montsant),453.75,3.1,0.38,CALC000123,430496-001-ANA001,CALC000125
2024-03-12,Embassament de Susqueda (Osor),300.62,20.7,48.23,CALC000158,171169-001-ANA009,CALC000168
2024-03-12,Embassament de la Baells (Cercs),591.14,19.7,21.54,CALC000697,082687-001-ANA015,CALC000713
2024-03-12,Embassament de la Llosa del Cavall (Navès),764.71,16.1,12.88,CALC000698,081419-003-ANA005,CALC000722
