date,name,total_volume,percentage,current_volume,sensor_current_volume,sensor_total_volume,sensor_percentage
2024-09-11,Embassament de la Llosa del Cavall (Navès),773.71,25.3,20.22,CALC000698,081419-003-ANA005,CALC000722
2024-09-11,Embassament de la Baells (Cercs),607.61,42.6,46.59,CALC000697,082687-001-ANA015,CALC000713
2024-09-11,Embassament de Susqueda (Osor),314.91,35.0,81.57,CALC000158,171169-001-ANA009,CALC000168
2024-09-11,Embassament de Siurana (Cornudella de Montsant),449.58,1.0,0.12,CALC000123,430496-001-ANA001,CALC000125
2024-09-11,Embassament de Sau (Vilanova de Sau),392.52,21.8,36.04,CALC000145,083036-001-ANA023,CALC000152
2024-09-11,Embassament de Sant Ponç (Clariana de Cardener),514.13,31.6,7.71,CALC000699,250753-004-ANA010,CALC000735
2024-09-11,Embassament de Riudecanyes,193.23,1.7,0.09,CALC000108,430537-001-ANA006,CALC000120
2024-09-11,Embassament de Foix (Castellet i la Gornal),98.09,63.7,2.38,CALC000004,080581-002-ANA006,CALC000041
2024-09-11,Embassament de Darnius Boadella (Darnius),136.82,18.6,11.35,CALC000005,170600-001-ANA021,CALC000046
